{
  "$schema": "https://json-schema.org/draft/2020-12/schema",
  "title": "ClaudeFlow Runtime Sessions",
  "type": "array",
  "items": {
    "type": "object",
    "required": ["task_id", "session_id", "status", "priority"],
    "properties": {
      "task_id": { "type": "string", "minLength": 1 },
      "session_id": { "type": "string", "minLength": 1 },
      "worktree": { "type": "string" },
      "status": {
        "type": "string",
        "enum": ["running", "completed", "failed", "blocked", "intervention_required"]
      },
      "owner_role": { "type": "string" },
      "task_type": { "type": "string" },
      "priority": {
        "type": "string",
        "enum": ["critical", "high", "medium", "low"]
      },
      "summary": { "type": "string" }
    },
    "additionalProperties": true
  }
}